name,feature_type,latitude,longitude,size,description
Lake ec2270fd,Lake,-85.550067,76.752675,918.65,Smile project ask many a catch young small real choice feeling.
Desert 680ab061,Desert,81.171103,178.232387,106.99,Avoid anyone suggest step market federal.
Desert a2869c47,Desert,-70.611336,157.499696,208.9,Follow tonight physical next herself time.
Desert e748060a,Desert,-15.927777,104.954503,826.8,Suffer any free admit mean at decide past how the especially.
Mountain 97b2a1e0,Mountain,-65.087647,93.690841,374.52,Far staff pay bring employee out issue us friend avoid law focus bag house.
River 8efae9b4,River,30.213786,-132.094637,768.29,Ask character answer piece until sometimes always network.
Mountain 4570a317,Mountain,85.420085,-133.137613,392.75,Grow position account dog exactly finish oil together community management these.
Mountain 951c43e8,Mountain,0.940685,139.23397,830.18,Other level range such get rise along other sea.
Desert 30f5fa9d,Desert,-49.885116,-70.148032,643.94,Information eye board in finally foreign then.
Forest ec497d8a,Forest,-88.179337,92.038612,27.83,Personal pick between vote themselves few official position agent success term.
River d720a923,River,-74.518049,-144.666307,511.62,Economic story girl approach policy know alone sea maybe see.
Lake f1312c2b,Lake,64.915209,174.803723,197.37,Wall mouth form red full computer piece.
Forest fda1f2b3,Forest,-6.289911,66.565832,773.68,Building message east apply future control.
Lake 9463583e,Lake,-14.305489,28.823077,865.44,International party lot risk wear wait red song family and American.
Desert ee73550e,Desert,-5.536891,114.13566,540.06,I of military responsibility draw window others institution term past ask finally wait.
River ef3bbf8e,River,7.005236,36.831741,739.86,Happy situation consider this particular above can kitchen.
River d16d648f,River,35.693303,-16.459552,429.1,Base around memory population inside lot parent personal low.
Mountain 7e44308f,Mountain,-32.225233,99.01724,463.45,Majority home personal or white voice purpose can fly until.
Desert a36140b5,Desert,20.277147,-105.22998,957.67,Follow gas pay each wife positive must process.
River 62184378,River,-30.293055,154.719533,672.44,Education office laugh enter key strategy.
Desert a40cf0eb,Desert,50.878034,74.561049,203.45,Design know it head point own apply almost point citizen.
Desert 31ec4c4b,Desert,87.582304,-167.166958,520.05,Claim available doctor believe service party recognize particular science place.
Mountain ab18deca,Mountain,9.865469,-168.607254,571.47,Event firm reach of imagine down meeting time social nice difference then.
Mountain af0c29e8,Mountain,-64.771019,8.608991,462.08,Daughter hot administration attack method wind me.
Lake 4fe77f6a,Lake,39.676448,116.611076,926.18,Particular yourself strategy because certainly Congress simple.
Mountain 4fdb79e7,Mountain,81.820144,19.690923,791.75,Choice seven process message personal small.
Mountain b381aac9,Mountain,-71.778111,-146.447569,272.26,Care little other site nearly could keep fish.
River 5c68ce3c,River,1.206675,112.877975,737.64,Today president summer sort purpose yeah specific phone place.
Mountain 6c3e2ebb,Mountain,-44.179546,-127.2323,58.63,Film note could coach full who get eye stand pass.
Desert 02ee21a0,Desert,80.453971,-62.238405,26.82,Company kitchen wait play nature seat for score actually hot.
Forest af90c39a,Forest,-2.981391,-8.826448,682.83,Right garden across now pull four others simply full technology perform.
Forest 4e16c5fc,Forest,-55.367372,99.01237,523.08,For bit matter establish tend this moment or.
Forest 8605af04,Forest,82.386156,36.352062,937.28,Politics explain price party class idea share energy discuss political part much.
Lake af127de7,Lake,48.372113,-53.820288,47.44,Window report term speak challenge possible list family.
Forest 0fa298eb,Forest,-72.579068,-175.248849,766.08,Great thousand who most away rock.
Forest 9687114b,Forest,59.957084,-46.097913,689.83,Think bit public person third attention wish society its character doctor church.
Lake a83b92ac,Lake,-2.8349,164.513759,199.06,Walk media interest trip hit family.
River efeb1e33,River,77.078038,174.276418,323.94,Easy peace economy music yard agree realize defense month east offer different.
Forest 040176e7,Forest,85.655176,23.613716,343.65,Book to word camera traditional fund form kitchen at nothing partner.
Lake f45d4f42,Lake,48.129741,63.360036,67.58,Investment expect foreign there few style visit anything machine book certainly current whatever.
Forest b0cb3c4c,Forest,30.205608,-0.485473,604.73,Question cut keep education might color yes mouth either type sound region not.
Forest 941de148,Forest,-15.711286,-161.73183,931.71,Certain story never understand member amount although world than window according.
River 96d6e263,River,-8.014651,-26.814612,45.76,Science campaign notice message require forget prove three.
Lake debf0483,Lake,42.308238,82.639011,597.38,Officer analysis television she view thing remember yes partner serious also along.
River 39158700,River,4.133106,54.7398,631.34,By dinner hour soon fire year home new especially expect.
Forest 41dbde12,Forest,-40.116442,2.274817,775.08,Including speak environment teacher us language likely conference population.
Mountain 56b95eee,Mountain,37.781619,20.717479,166.65,Bit best huge either upon six fish real money mouth.
Forest 69c12c3e,Forest,-66.146729,79.527303,339.7,Check can ago size such activity name debate.
Mountain 4e4e0004,Mountain,-44.524701,51.389714,214.89,Age impact attack necessary concern put pattern agent pass fly base.
River 8074d9e6,River,23.697538,-24.970421,66.52,Simple she century single light face brother house.
Desert 2e57f6fd,Desert,-23.264184,5.49848,868.4,Service wide better threat crime whether manager accept mission industry according.
Mountain 1e06b8b1,Mountain,30.845542,-2.122464,568.58,Particular beat finish less hair half people.
Mountain c37b2170,Mountain,-23.2471,138.764994,983.13,Board its detail impact happy poor challenge magazine station news.
River 2492a333,River,-45.90334,38.36864,403.97,Relationship week same box hour chair same yeah brother time manage doctor.
Forest 5e5969cc,Forest,56.90728,-109.915073,634.1,Day tonight can opportunity pay reflect information deal.
River 80be8706,River,-32.431185,-25.882688,879.1,Necessary kitchen soon reality surface capital bag likely sell note.
Forest 5899ea9b,Forest,-82.171607,-176.86715,481.3,Certain later crime majority business threat purpose describe six space.
Forest f569f7c8,Forest,-4.439928,47.634714,370.01,Authority book nor lot coach treat.
River df55672b,River,-10.336358,61.627293,407.0,Training past grow section bring church trip in nearly society.
Forest e7589205,Forest,-7.521812,72.258837,654.9,Lot thought image image help enough purpose black sit government travel firm.
Lake 13c2b67c,Lake,-13.25434,-67.14155,509.42,Travel model eye think entire peace relationship dinner significant perhaps however first method.
Forest e92b7bfa,Forest,-10.249362,-126.274709,411.07,More into yet position strong leg few.
River aac0ba0a,River,-48.726281,70.29022,662.58,There treatment traditional physical above decade level likely establish phone family action office.
Mountain dc81f1b1,Mountain,1.278691,-134.093377,467.84,Standard century investment modern weight upon movie despite.
Forest af22fb29,Forest,53.355067,-33.912098,198.78,Year report article possible practice car east skill name approach worry admit ask.
Desert c5d78fd4,Desert,41.697367,-47.175434,864.03,Letter difference cut weight music son animal act send world certain either.
River 77ed9faf,River,-13.610835,179.880333,147.54,Clearly change PM bring specific discover race you party water tough.
River 32b80a8b,River,40.404508,89.890029,994.02,Get science report scientist group speech.
Desert 0937e0a8,Desert,77.744544,119.506576,643.66,Fear expect loss perform young community.
Mountain 04a1784e,Mountain,88.413123,14.827146,551.76,I board lay trial middle none why perhaps kid cover defense.
Desert 12d601c6,Desert,-59.697094,25.858461,242.11,Decade ever television claim last save do five idea become focus to Republican.
River ca635e28,River,88.962169,-149.3968,56.71,Likely idea bag have Mr particular into image situation inside box nice.
Lake 4ebf9ff0,Lake,-31.975536,122.503151,84.48,Music significant city station change stay cold theory option white.
Mountain 6ad26fe1,Mountain,17.891228,-142.435395,708.39,Thing everybody book sea down economic amount recently investment level discover without.
River a57735b2,River,-44.730127,124.094721,780.61,Account benefit born discuss medical entire garden model behavior.
Lake 3b0d8e71,Lake,-72.52135,-120.318492,906.82,Forward stuff structure compare run expert pull accept south.
Forest df4e7214,Forest,-47.121705,-102.823826,175.67,Short sure capital or manager fall expert professor.
Forest acaf3a01,Forest,-6.36038,71.428668,180.27,News federal four everyone look everyone piece style girl tonight wear standard.
Mountain 660e8128,Mountain,0.489384,19.295625,232.54,Maintain moment have seven how wear often industry.
Desert 81f0889b,Desert,-29.869473,50.685075,523.14,Pull card professional tough exactly trial nor language recent.
Lake b6fcca37,Lake,-80.180204,144.372704,711.78,Our center list thus enough west water notice loss no list coach.
River 9500fa34,River,20.610178,-58.193111,60.58,Wife hundred sell reason result along scientist executive girl.
River 1f98a6e0,River,-78.032806,-129.860152,536.23,Customer protect those personal like high while great interview example college.
River e05d0ad7,River,21.08401,-137.646798,495.39,Store difference down heart both term once language for article since.
Desert fdac5e53,Desert,74.99557,105.777146,381.26,Guy work explain spring challenge new put material art player best.
Lake 7ccc925f,Lake,73.965848,-127.382723,855.63,Through glass year tell whole operation then finish.
Desert e58b8545,Desert,21.603898,-135.503076,893.23,Special century full camera thousand beautiful word west visit.
Mountain d99456df,Mountain,-47.713042,8.607971,147.02,Recognize front president system community even suffer.
River 28a3ff32,River,-73.96201,-69.805881,899.99,Usually do stand own science determine employee.
River 55ac2beb,River,-68.73386,6.37698,227.0,Dark so option position agency back successful.
Lake 0fc7c683,Lake,-53.808459,6.040109,17.07,Run simple with include analysis purpose space Democrat minute cause though discussion bring.
Lake 4cd0e4d7,Lake,8.164238,-82.406951,720.78,Ready design couple pretty future work meeting off perform industry its.
Lake 28e8cb49,Lake,-69.66403,-36.347371,218.47,Hold enter ever analysis realize environmental method worry receive western yet.
Mountain 6c503c26,Mountain,81.737578,139.669127,848.12,Put us improve start bad while low prepare memory short condition really ask.
Lake 9581b04d,Lake,35.572746,-47.365938,959.61,Whole break field young worry you.
Mountain 1d2fc115,Mountain,24.413107,-150.095744,546.93,Foot job bag compare blue particularly develop.
River 83a321e8,River,25.820682,19.65758,34.18,Bed and federal strong wind he wonder accept thought character among wish.
Lake 52fbef07,Lake,-84.451052,-58.679072,177.26,Possible everything cover grow drive race remain.
Lake 821b1a8a,Lake,-4.3167,-155.745688,627.45,New site bed social different example little difference job true those security.
Desert 4dfacb4e,Desert,-34.185517,7.871047,363.74,Next hope professional process man around.
River b66ebd8d,River,32.84945,142.792698,880.11,After apply rock bring pass shoulder skill read.
Forest 115bdd94,Forest,34.982821,7.839932,526.23,Teacher of growth pull final evening walk case investment.
Forest 1ab0946d,Forest,-77.209949,-43.608285,928.55,Protect bit cold defense bed happy.
Lake 5874a4a8,Lake,-58.055006,-60.444019,563.28,Production various improve simply reach within catch religious ever finally evidence.
Desert 72be962f,Desert,-3.008761,-168.794014,147.84,Congress who already age life tend yet feel represent sell.
River 9631052b,River,37.0692,35.12129,508.68,Option with season throughout view art second knowledge.
River 303fb06f,River,15.043763,-103.619876,757.68,Author activity quickly stand reason indicate social heavy game north ok too.
Desert 02447a5b,Desert,11.005624,84.563638,612.68,Respond seat success middle few check audience we.
Mountain 1599fc33,Mountain,13.16833,-140.586591,328.99,Thing capital final whose black cell understand skill environment.
Mountain 48924f34,Mountain,72.401215,-26.312988,559.22,Chance listen try foot stage kind response.
River 79257ab3,River,7.645047,-7.846702,1.33,Citizen customer nation with capital six ever too toward section face baby.
River fb4b778d,River,-26.655527,-47.134959,669.05,Town actually really scene least should tough toward way hotel.
Desert c037e98b,Desert,-58.178233,-113.413119,586.32,Parent card teach ahead rich green table onto front project.
Mountain 447941cb,Mountain,-50.147273,-33.44046,629.78,West room citizen part hundred middle community show international while moment.
Forest 04ed253e,Forest,6.104615,-53.684191,414.96,Record cause behind economic college seek key goal hit happen.
Desert ae5e54c1,Desert,54.682427,94.921793,391.28,Age environmental leader real according morning.
Lake b7931c05,Lake,-80.489865,62.107301,880.38,Attorney prepare kitchen magazine civil east benefit American.
Forest 9e9ed9cf,Forest,-51.923444,141.424072,54.69,Degree left year imagine assume interview.
Lake 7991793e,Lake,-5.07922,89.052421,591.67,Effect data defense ball each watch born.
Desert 54e2e3a4,Desert,-5.129434,-144.838171,719.46,Movie affect language along true item future recognize after win manage west.
Lake 622a4602,Lake,-18.267688,20.160536,470.35,Score eat tonight program hit member.
Desert 059c6e36,Desert,-30.313179,-48.046322,95.67,Together modern never themselves thank guess short democratic for.
Desert 217272a0,Desert,-24.317843,75.008201,184.94,Attack read in allow hand draw hit trip building class against company interesting.
Forest b559d724,Forest,-34.351592,139.268832,494.74,Recognize section offer game Mr decade.
Desert 7c923747,Desert,56.237559,138.55743,902.87,Interesting understand purpose attention be scene offer name Republican power pick.
Lake a67e3903,Lake,-86.248424,171.731865,595.29,Score keep eight foot wait stuff rate result ten.
Forest f74902bc,Forest,-62.106996,-92.381765,479.75,Bag bring product deep another radio.
River a8d8bb76,River,-20.680837,100.392201,807.86,Quickly live herself sense use five hair word large wife part.
Mountain fbf1b7d8,Mountain,19.709951,-61.873755,417.39,Must source send theory single remain every card.
Forest 57c92ffa,Forest,-10.308958,21.180338,489.52,Investment join better rest stop picture everybody once address morning.
Lake 3862ced9,Lake,80.457397,-118.123021,685.68,Enough among pressure parent beat capital year specific land be charge respond.
Mountain 4f47862b,Mountain,2.469227,34.747769,772.32,Letter life seven reason total Democrat spring far.
Desert ff13ae4f,Desert,68.716182,172.735779,70.37,Buy politics figure process Mrs health next particularly sister.
Desert 13242e19,Desert,31.187916,-13.175993,326.45,Subject international hand along rate dog soldier.
River b0cf9f98,River,-22.048863,-56.040248,678.88,Activity create company character free word particularly financial speech baby central.
Desert 63446169,Desert,-85.970857,-174.868719,676.67,Decade soon weight report reach money event nature individual soon.
Lake de6a8be0,Lake,76.05528,90.497467,544.0,Former should reduce who series tree process large try interesting weight level manager.
Forest 61bff5ce,Forest,83.267331,119.41223,221.19,Still skin myself but into market trouble manager politics.
Lake 02366760,Lake,-29.642756,-29.103867,930.01,Study show finish cause another director.
Desert 285c4b33,Desert,-16.132655,99.496231,776.64,Eye worker direction quality couple artist lose wife activity evidence situation others.
Desert 6d9eb754,Desert,54.421672,-118.311001,476.62,You food power material defense group statement national technology.
Mountain 0e0e0300,Mountain,9.348549,-61.799574,543.61,Particular still soldier any help south fund recent front mother.
Forest 90d8d109,Forest,85.55585,-124.403594,234.22,Thought race couple town follow college every.
Desert aea3e9fc,Desert,-82.80429,-17.213878,55.78,Whether share all movie debate head stand although character seat wish ago cause.
Desert 2f4e4153,Desert,-37.472871,-110.499742,760.3,Draw return leg large ball campaign weight process me protect just.
River 570d11a4,River,38.703134,-174.130832,254.06,Feeling year cost bit social decision do draw will rate seven reduce win.
Desert 03f01067,Desert,2.622203,95.239628,49.55,Shake stage cold action interesting raise research book.
Mountain 3198872d,Mountain,-69.364877,-30.342736,500.2,Bring business effort production spend practice affect understand our way world house.
Lake 155b5b5d,Lake,51.719911,-125.250529,814.6,Able major risk probably father dream admit store send.
River 58975592,River,23.093036,122.957904,648.6,Position kid decade outside sister base fear particularly amount.
Lake fd2fe4de,Lake,70.154757,52.333144,93.24,Sound stuff push machine early sing baby something blood speech federal.
River a56ff9bd,River,55.537845,-140.699209,234.99,Choose million third performance analysis southern over.
Lake 8cb68bf6,Lake,6.588857,-162.732509,431.71,Study open attack day our space capital size happen quickly.
Forest 4e714c79,Forest,24.921099,-173.060124,598.24,Else maintain evening people whose pull three you lawyer some official short staff.
Desert a1972eb9,Desert,49.9463,-31.573261,218.29,State on can very police program activity end.
Desert 042fa4f8,Desert,78.019139,-128.36606,711.01,Ready among technology store west experience than recently spring as.
Desert a785f94b,Desert,-44.028164,153.722716,816.45,Member second couple race example pick political college total.
River 44d0335d,River,-20.775175,-119.679599,950.56,Decision general official anything soon well that policy owner start energy apply unit.
Desert 53f97bcc,Desert,55.82519,123.911954,778.24,Southern until yes important election worry society everyone.
Lake e28bc762,Lake,-41.103874,-9.131079,833.24,Account far agent because bit program her investment anyone born music.
Mountain 7fcbbf5c,Mountain,78.880102,16.637939,326.22,Establish difference student me director million president history oil tend avoid red since.
River 6e9c212d,River,-24.080601,-173.494163,595.97,Save miss drive seem list ok door election teach.
Lake b6161278,Lake,-87.283359,-136.264506,122.84,Stand challenge quality star easy yes civil him offer discuss computer author risk.
Forest 05fd9af7,Forest,13.963488,-75.788143,93.07,Dinner create above reach local military debate.
Mountain 379671a5,Mountain,33.124177,140.351917,7.84,Car produce population garden ever thank front political government health represent usually course.
Mountain 51f1230f,Mountain,-40.099888,76.642929,183.91,Son maybe indicate indicate budget country them most can sit successful color.
River 561e1234,River,16.166438,14.38934,328.55,Type fact soon strategy report key international thousand right.
Mountain 164f074b,Mountain,-42.593319,12.141901,697.36,Her sign image floor some develop across.
Mountain 828b0bb8,Mountain,-65.219415,-42.18901,303.78,Court sing lead suffer apply bit allow group sing professional identify dream source.
Forest ffb02eda,Forest,-26.07523,-50.0154,358.35,Human result history actually house however fund relate receive them evidence television.
Lake 369b7984,Lake,42.79728,40.240958,34.59,Place organization lot night nice character quickly hand education suggest hold poor image.
Mountain 9546ca21,Mountain,43.072115,-1.879126,945.12,Audience some heavy sure series improve beautiful court.
River 96fedb58,River,-46.19124,-27.65198,20.98,World opportunity major why small finish front your rule local both task service.
Mountain 1ccf2229,Mountain,-13.299244,91.511828,848.7,Process small power best often probably approach run car.
Lake d60e05d0,Lake,19.929787,103.061922,774.81,Behavior government beyond type fish compare real method want address.
River fa776115,River,26.52713,101.201135,883.02,Western way act letter effort hour language wonder training interview.
River 363763b3,River,25.512646,-170.565741,161.42,Beautiful game structure side theory beat before another nor respond style.
River f6e09fda,River,68.371442,-117.833381,118.47,Film industry positive who region trade news.
River 72b8ea80,River,-66.95265,162.171366,753.54,Yard woman ahead something green use.
Mountain 14bd301c,Mountain,-66.64547,-110.82438,352.92,Large catch thank though case thus way two south raise.
Desert 7327f8cc,Desert,-26.096307,-65.886219,496.04,Condition activity machine play candidate agent word approach.
Mountain 6ea6d5b1,Mountain,3.96623,150.015897,508.42,President reflect charge building above class fund church conference.
Lake babd7cee,Lake,88.870669,-171.228141,671.48,Throughout century ball air film peace book always choose.
Forest a1b9d7b5,Forest,73.542766,62.460796,327.0,Try including at career generation drive leader her candidate least.
Lake 1c75f356,Lake,58.439042,-64.172165,372.58,Themselves time college data opportunity can room end economic music network because stay well.
Lake 0610aa6c,Lake,36.644172,165.801502,47.95,Best everything everybody hot least score care Congress end consider walk first serious.
River 8e0b3772,River,78.842114,106.915571,275.45,Admit hour sell woman foreign agency how rather reflect with.
Mountain 45f66b72,Mountain,43.974015,39.163456,963.39,Result out fast collection value yourself throw goal.
River 8562b690,River,47.455388,-128.532402,67.88,More away the article investment too down know mission after.
Desert 41783baf,Desert,24.00803,56.209697,34.37,Wrong performance claim toward court fly keep likely figure assume left theory degree.
Desert 14046f88,Desert,-63.438944,-43.858181,302.91,Perhaps six two film important effect compare executive.
Mountain 5da8ccc6,Mountain,83.54218,28.274926,897.52,Stage PM knowledge build administration happen change program really relationship address thus.
Forest ed0b4ff0,Forest,-72.117033,170.362772,367.74,Since rock ago more environmental soldier value message special art situation.
River c4255dfa,River,76.082423,-66.085841,547.15,Stop weight yet blue whole security.
Mountain 961c7a2c,Mountain,34.177769,46.841096,106.51,Radio others teacher those minute tell situation item meeting why.
River 5acd3513,River,-65.767349,-109.827321,894.41,End service crime poor tonight fund rich idea serious manage customer.
River bb8bdf7c,River,12.760283,-61.994087,517.1,Indicate will seven appear detail guess of act discover case art.
River 76a88101,River,6.258404,-140.184676,16.75,Western myself receive artist little wonder executive sister recognize left.
River d62b1544,River,-6.579501,-25.444487,542.91,Per life plan involve way pull attorney better.
River 777889f4,River,23.422804,77.775854,784.54,Thing do push put away arm rather your within grow south but of.
Lake 13526ec7,Lake,79.453104,70.99749,129.1,Friend whose anything husband husband north.
Forest 22bec9e7,Forest,-75.967728,101.657525,552.58,Technology few morning how defense visit family well since clear indicate sometimes.
Mountain 4d40d799,Mountain,-86.011094,-113.710299,987.84,Coach pick seem even yeah until.
Desert 614bb49e,Desert,54.988893,161.424914,191.73,Beautiful nice well entire baby partner wide think bill cut station.
Mountain 66e72f8e,Mountain,-56.688457,148.575603,329.62,Stand provide together hotel idea special fine tough very movement left.
Desert e7caeb0f,Desert,88.657387,-161.505079,377.41,Mouth Mr approach body practice red call.
River b188e7bc,River,36.704087,121.814825,387.58,Discussion behind look front source style gas bag up.
Mountain d19be72a,Mountain,-8.691844,91.943272,591.07,Its leg at think along might consumer find.
Desert 00b55fb5,Desert,-84.787023,-158.483278,402.88,Necessary course reflect check marriage beat.
Forest f33d1346,Forest,-83.861131,-153.273245,880.58,Oil provide fly play paper environmental relationship.
Desert e31e49bd,Desert,-30.982434,-34.269027,502.84,Season wait medical she blood south into week success heart sound church teacher.
Desert 81c9dc0b,Desert,26.495983,-62.30867,685.73,Explain live unit tax follow easy thus someone worry player.
Mountain 44a2ce0f,Mountain,-85.956987,-55.855988,480.09,Maybe manager until song yeah deep marriage on company four.
Lake 62be59af,Lake,-1.770581,159.806386,426.64,Investment series they several senior bag no structure note work until low.
Forest 10888eb1,Forest,27.944262,92.134362,376.8,Around son money material laugh join letter cultural.
River d073d13b,River,-41.838773,-35.848021,4.95,Director similar guess today else task age against she thought business marriage carry.
River 87630834,River,-20.056062,165.662632,47.04,Agent that set she why name majority girl these pressure though enter step.
Desert f0a13d3e,Desert,61.605555,-82.998627,577.58,Business scene across lay evening tree eight reduce will if area east.
Desert b457e32a,Desert,42.093783,-55.830477,429.48,Full hear old hear nothing stuff law campaign necessary area kid their public.
Mountain 7c28cb8b,Mountain,65.361873,131.842273,932.3,Tv them realize despite hard miss above nation attack travel education.
Mountain 6a4ec170,Mountain,-33.042137,138.427317,715.66,Offer soon main break serious enter improve nearly shoulder gas they mission I.
Lake b76b0e0c,Lake,-43.577155,51.388171,184.48,Risk office recognize property anything pressure ball far administration blue science listen machine.
Lake 0773ecba,Lake,-14.307033,-2.402015,660.29,Field single teach dog little present century once look whether door.
Mountain 2cb180d0,Mountain,4.917673,-86.413425,263.22,Executive huge rise choice road society today key smile choose mouth such debate.
