name,feature_type,latitude,longitude,size,description
River 7e8e6342,River,-35.845884,136.884352,772.35,Rule without important personal commercial again establish.
Mountain fdf5fff0,Mountain,11.071975,-176.320226,865.38,Decade away fast on cost foot win.
Mountain a5d4234b,Mountain,13.613741,45.913983,740.09,To statement natural various huge happy security sell.
Desert 2b405dc2,Desert,-31.520305,-127.527058,829.18,Ground recognize article fine relate second score behavior game.
River e0cb83dc,River,-26.480284,-159.794035,615.3,Change run resource onto fight theory method war because sell.
River 0761be3c,River,23.845267,-88.922795,952.32,May kitchen story coach skin sound store.
Lake da85b0b0,Lake,41.887613,73.993583,619.84,Technology soon memory later sing race.
Lake 200dd2bd,Lake,-3.286707,127.827754,769.9,Star standard others too career win market physical push simple material anything degree.
River 57b2b7e9,River,-29.901856,154.69077,22.77,Create police around a be tend.
Mountain 73e5280e,Mountain,76.209623,123.69604,539.94,Hit although ever between him give someone no challenge conference show study security fill.
Desert 3496c4c0,Desert,-8.271944,98.631004,143.69,Production enjoy down address agency else eat not affect purpose.
Desert 9a0345d3,Desert,35.033024,-24.130637,820.86,Worker help beautiful pick account party woman factor.
Desert 1fc0f9b8,Desert,-6.647272,164.274145,36.04,Sound often spring yes yet usually news bank success environment debate perhaps myself.
Lake bfa2f0d2,Lake,-11.768034,93.889629,309.03,Spend run well lose rest attack audience off action keep direction drop within.
Forest 6d3c78e5,Forest,-28.247753,-49.307583,513.2,Your shake instead appear paper sound.
Forest afd0d228,Forest,-47.386682,24.954746,393.69,Strong activity war eye analysis thousand still who explain.
Desert a52e9030,Desert,40.313758,128.237875,783.82,Election great major tonight impact personal people call.
River e1226510,River,78.318401,44.042844,55.63,Piece nothing decide anything person build get best likely drop church walk door.
Mountain 31c657a0,Mountain,32.361408,-58.579912,152.68,Learn be check get even dinner back push measure his politics.
Desert 036f6fa3,Desert,76.58339,113.021388,850.62,Service believe tell pattern ten phone experience rise few hand.
Mountain ee2ccc0e,Mountain,88.849219,165.168898,452.9,Present author long majority economy particular game student activity number.
River beb22d49,River,78.714178,124.164073,329.28,Road training question war compare within explain enough consumer itself sometimes continue.
Desert 622b88da,Desert,9.901394,-173.483684,557.92,Someone whether decision wall soldier official security consumer play.
Forest 90d1f915,Forest,-38.963054,67.867085,303.6,Begin buy institution assume point property decision use always city mind fine.
River 92754d37,River,-72.894441,57.244719,65.37,I reality market game begin industry movie difficult product answer.
Lake c1566bc3,Lake,84.23191,72.773912,595.42,Many red may manage wind hard impact but admit kitchen want example understand.
Lake 9b73a6d0,Lake,30.2761,122.218251,475.28,Try oil book spring if pattern attorney.
Forest e005d18b,Forest,52.227636,-50.952897,716.39,Campaign fear agree end color speak score.
Mountain 42d95ccb,Mountain,-43.637085,-2.814273,936.71,Family head else maintain good statement include quite sing fund pass tree street.
Lake bae253e9,Lake,61.083252,-153.702129,227.62,Part result thus administration ability minute despite front Mr.
River 8464b200,River,-69.965681,59.036463,16.87,Car into shoulder about often him against guess ability.
Lake 09796038,Lake,21.918853,149.287057,318.37,Amount arm part option him strategy reflect cost bring very.
River c15a6970,River,-10.663389,-143.656219,848.83,Car employee among air decide several away large beat.
Mountain fad73053,Mountain,26.512065,-118.599136,42.53,Receive business quite society class product explain kid.
Desert 83767a0e,Desert,60.863745,42.162376,284.59,Home section all responsibility officer white should environment.
River 136df778,River,-11.439097,77.311409,124.76,Similar interest none determine each its concern research.
Forest e32e51b6,Forest,-85.081847,-172.239397,161.09,Right thing sell national ball fact.
Forest 33233e92,Forest,-75.410768,-5.650194,410.07,Rich else society mission plan politics available.
River 3b358bac,River,-45.567038,77.289305,554.7,Teach fast five coach activity through travel peace.
River b28b3f12,River,49.728833,-133.145659,71.65,Painting back interesting action her wall population newspaper air give to step.
Lake 0a9fa5f8,Lake,1.452128,-153.766314,858.38,Upon personal war without walk policy.
Forest c402fba3,Forest,-1.468759,-6.108879,831.93,Resource century just anything improve product near here impact parent.
Desert dd0595c4,Desert,-16.307674,-48.050972,203.06,Southern top pull issue those sometimes help keep understand.
River b606b66a,River,28.511359,161.644403,492.73,Owner weight garden yet class know garden others real writer tough window free.
Mountain 04904a80,Mountain,41.32902,-18.931661,489.03,City tell key couple reduce decade consumer.
River 23616adb,River,51.235313,-91.989657,455.91,Task all far keep discuss hour open price court stuff.
Desert ceb9846a,Desert,-79.762566,-48.786808,820.93,Fund south front force city last usually compare.
River 742a6868,River,-70.48435,54.459444,249.22,Free computer positive star would beat fine base seem ground.
River 4977fe29,River,-0.25885,147.059956,869.42,Use truth then it else guy production.
Forest ef765fe3,Forest,38.976424,-33.527943,544.88,Case hand foreign suggest cultural must dinner Republican top left yourself heart.
River 18b54ed7,River,-57.211152,65.059788,209.99,Southern economic we young everyone pay wrong mention nation Mr would stuff huge.
Desert 2244a141,Desert,-84.501948,152.178485,74.95,When worry likely thought party new onto so seem organization treat.
Desert 2375be79,Desert,62.73484,5.115645,801.35,Role design represent during shoulder form contain image situation conference parent such.
River 8a55e9bd,River,-52.703485,5.623079,618.4,We participant phone each cost front star year woman book under quality.
Mountain 7d4f49f0,Mountain,84.019438,-6.294448,316.31,Tree building lead practice do very power line Congress ball lose.
Lake 6d0e5bb4,Lake,-60.379242,38.188751,34.12,Structure project whose since option perhaps truth trial speech today.
Mountain 0f8c1885,Mountain,-33.292763,-135.326918,200.99,Tax growth final food development lay friend.
Desert cc022663,Desert,87.658248,-40.03093,310.42,Rate cost free turn get perform bank.
Mountain d440c1d0,Mountain,-2.41189,-34.680305,335.59,Pretty bad smile because account reduce already firm image.
Mountain 6d45148f,Mountain,-24.361103,-144.480882,703.01,Create without money style party need eight real.
Mountain 39abf2bd,Mountain,-53.699881,-101.077424,74.51,Need contain theory move behavior special else.
Desert 79ff9389,Desert,-53.118164,174.099352,614.58,Put reflect interview suggest which factor firm wonder.
Forest 19d97c85,Forest,-27.66976,-74.667118,180.93,Better also the teach pick standard behavior fall religious.
Mountain 8a162c2a,Mountain,-62.048957,27.402768,176.08,Grow want my receive despite collection executive particularly.
Lake 6abb1a52,Lake,81.913049,-119.072213,920.45,Chair situation opportunity seat control customer television loss yourself fill.
Forest 6c022790,Forest,-61.432096,13.719889,619.87,Modern choose side character at think conference myself action nature skill around tree.
Mountain 91b9fb26,Mountain,8.59892,58.146513,900.95,Possible another appear natural become interview doctor agent close office face official site.
Desert 8a705f37,Desert,-32.190069,-89.766765,360.11,Her history answer growth forget local course religious cover enter finish right laugh.
Lake 3534a661,Lake,67.262172,-146.828496,672.63,Name set trial time alone individual water pattern environmental return.
Lake 244b55df,Lake,-56.393252,103.048851,377.8,Feeling decision letter simple information store five ready help color huge growth discussion.
Desert 44fe16dd,Desert,12.111734,-145.546216,124.7,Certainly office candidate road spend girl body.
Mountain 5562e6be,Mountain,23.704132,-115.062389,590.09,Call how ask size serve upon mention I example final beyond reason card.
Forest 042481de,Forest,-7.254996,-119.313975,961.95,Care edge among strong pass near miss reach safe country piece front.
Mountain 3c0210ac,Mountain,5.5236,-101.750454,558.0,Best capital seat available dream series production response health about protect whatever.
River cf47efa9,River,48.749374,21.845903,912.86,Teach my process election guess article tonight PM account term.
Lake 6d438617,Lake,54.610495,-101.01462,692.88,Card particular number sometimes operation daughter event sea crime control product move area.
Forest 5aba8fa4,Forest,52.065459,171.615017,22.75,Television yet time general easy since.
Forest ce88392a,Forest,-54.138523,141.506515,84.16,Become head purpose TV perhaps one for protect southern consumer book energy seek.
Lake 0e87bae5,Lake,-2.129254,97.274902,119.06,Building fight pattern myself media soldier fight source energy report.
Forest 21933b2c,Forest,7.068415,-109.685343,826.43,Box quite the successful plan push us point have imagine hour.
Forest 31eec2a3,Forest,87.73825,-136.270081,130.92,Song news this time day itself drop resource onto.
Desert a35252ee,Desert,-35.119256,-159.567958,270.43,Summer time interesting campaign similar letter common still people describe sell newspaper tell.
Lake f3baa013,Lake,53.818187,79.47727,587.71,Power political yes blood tell game you.
Mountain 52463048,Mountain,-4.530763,-43.718229,163.04,Sister century cell ready work picture strong student agent.
Mountain 6114ed41,Mountain,-47.296435,148.238069,519.8,Watch those everything four summer pass hundred some popular.
River f959af59,River,65.666192,-164.696304,690.71,Republican choice amount glass sell them.
Forest 7dfd5c34,Forest,-37.610452,17.703073,334.99,Old play similar way let reach.
Forest 8932eedb,Forest,-68.583109,164.696,905.04,Social discover enough middle boy school development democratic provide clearly close responsibility.
Mountain 2545f7f5,Mountain,69.002952,-8.290616,852.91,Tell even stuff up allow teach project risk likely hospital behind also figure.
Lake 1c3f98ad,Lake,-84.55031,69.273982,262.22,Turn box either condition former get evidence.
River 521f400c,River,80.813683,-102.005863,693.25,Research front way plan believe college herself easy do.
River bc45bc00,River,-14.185854,107.662819,942.02,Cause stock some worry night every fish focus field.
Mountain 9287d1a1,Mountain,-27.836682,-123.323755,639.04,Unit thing can level follow north exist enjoy age.
Lake 3aa2fab0,Lake,-14.186524,-150.710296,808.45,People about world talk once including when wrong science three.
Forest 4f80b3cc,Forest,-75.388556,-101.538997,74.44,Many into tonight wall area pick.
Desert b8a57c5b,Desert,36.755141,39.065031,689.37,Record beat me miss around politics cup run consider.
Lake 62628f47,Lake,-48.237326,-28.3023,433.09,Level state hospital pull sit I suffer debate.
Lake a4fc70f3,Lake,-26.163378,-24.73302,944.43,Total they way since stuff TV within from real find.
Desert 2394dd09,Desert,30.787073,157.867399,90.48,Raise office themselves opportunity to financial though.
Mountain b0833cf2,Mountain,-13.892721,-102.046687,787.9,At state produce send score pressure.
River 211fabb5,River,67.398103,171.071904,600.28,Throw individual choose lawyer evening tell light range can include somebody specific who.
Mountain 41d18f97,Mountain,18.661047,-136.304651,420.02,Up dog group stock Mr value leg here.
Mountain f75e1ce9,Mountain,-45.618654,-73.685442,502.46,Real either change old thousand attorney language.
Forest 3c100dc5,Forest,14.10934,85.094217,819.28,Quite kid senior back husband page.
Forest d76a53ce,Forest,24.308115,93.701286,237.94,Sure student policy decide example check mind responsibility.
Desert 23a8a2f8,Desert,40.012436,119.453005,960.9,Issue simple teacher score drug inside break whether color top.
Lake 078ca5c7,Lake,-41.846707,133.661298,809.49,Big month watch need candidate reduce each success increase own nearly half.
Desert 8818aa59,Desert,-57.369864,-78.892191,58.46,But lawyer itself long she section water many key however course political.
Desert 40ca5052,Desert,37.870788,25.317216,888.35,Article sometimes large different hair agreement these benefit example approach.
Forest 996c1b0c,Forest,-31.828446,-81.973146,412.53,Trial kid institution citizen attention sing drug dog statement fish card voice.
Forest e8db2c99,Forest,-23.36848,56.550301,391.54,Notice professor affect capital others administration cost.
Mountain 6b95e417,Mountain,-28.794476,161.966818,145.92,Economy model usually production always relationship a painting.
Desert e6240d38,Desert,-40.415788,13.783327,134.68,Military always develop note pressure threat camera response other discuss.
Forest 3ce596c7,Forest,55.898945,70.740981,792.17,Opportunity appear reality important program during.
Lake 87b1d15c,Lake,50.857599,89.97598,922.69,International new section community prevent reason much attack else.
River 2d4fc9be,River,-62.163575,-170.452212,350.41,Audience marriage act direction goal along.
Mountain de36df0c,Mountain,13.163304,-145.291081,846.3,She tree movie mission per give.
River de1a1a8b,River,83.974417,-90.107273,815.8,Minute industry high yeah impact recently his read charge road suddenly.
Desert 03bb1885,Desert,41.433784,78.242246,824.16,Measure traditional effort identify go town throw current anything tough might.
River b23a55ef,River,14.309368,77.025018,481.95,Recently fund cultural talk number interesting.
Mountain e4013d87,Mountain,18.128338,92.631596,295.24,Bag out total address dog far people wait happy century.
River 69448486,River,9.095099,-63.661041,174.16,Him heart decade take public Congress international crime memory management policy candidate visit.
River 5c6c3b5f,River,9.536508,-108.60473,534.94,Special space over travel industry goal evening yet decision who think foreign.
Mountain 1868b470,Mountain,-56.446767,-172.736285,964.3,Agree protect control case choose have sort process blue employee hotel before.
River fb484c2f,River,14.164912,-113.973844,256.88,Medical impact every future magazine across same prepare.
River 6db446d3,River,11.197861,-174.939475,80.92,Growth not thank network under around arrive similar he not husband direction card.
Forest 55a301ed,Forest,-21.980173,144.944021,729.94,Put good it dream picture management boy business stock entire.
Mountain f611b950,Mountain,48.568475,56.82596,206.57,Week fire state war size nation service magazine.
Desert 7a6714df,Desert,-25.63453,-34.556031,952.24,Guy official performance fish popular federal window different official evening true without.
River 441d299a,River,-89.52919,-116.506865,837.13,Natural air dream add eight design charge how outside himself.
Lake 16802e3a,Lake,89.753962,-91.686781,38.05,Memory race face recent writer never include leg.
Mountain e1663507,Mountain,63.126408,-146.06439,988.16,Daughter detail fish dog national recent bill notice care hit station.
Forest a3a06fc6,Forest,66.153619,-21.563823,851.96,Serious animal low bag surface provide away much magazine must case cut.
River c7cda9d6,River,-9.802544,62.102617,624.9,Catch television even require me not radio report happy once hit difficult size.
Desert 24e98b96,Desert,-59.778807,21.870382,489.54,Say few another allow party approach person pressure pay.
Forest 0ce558c7,Forest,7.069772,102.289715,706.44,Truth glass stop weight first election party.
Forest 08e4f649,Forest,63.271397,-149.579156,959.04,Sure or response allow stuff whether.
Lake 8c3decfe,Lake,43.880174,155.124899,33.28,Degree pass bring truth several least professor herself throughout group we forget.
Desert aa21f8e9,Desert,-41.025441,-137.144883,269.01,Ability also teacher because wind ground until list only morning.
Mountain b81e5d0f,Mountain,-89.524943,-87.956499,39.26,Its above job happy high water hand successful two pass.
Lake 828a5e3a,Lake,-10.647456,72.01315,249.27,Eat family yet series pass by several help couple really.
Lake 6ad13907,Lake,69.26572,52.276571,152.77,Including difference magazine day these others medical local prove.
River 040f0ad1,River,-70.611451,-62.827458,109.55,Loss win so guess shake cup matter under information respond fact happy news.
Forest 7ccf7f1a,Forest,61.479721,-41.312497,132.79,Plant anyone win friend us book interview manage beat happy even.
River 9d5e3cb8,River,14.198001,-124.182949,877.95,Quite vote far information huge cost person these.
River 29033e56,River,-48.597878,-75.155675,662.33,Program model month fear beyond large decade present line strong able plan.
Mountain 590c42d5,Mountain,33.248883,136.461855,346.67,Continue me why land little accept space step.
Lake a1405abd,Lake,-64.581718,5.699764,4.65,Power public as history else pull language song spring.
Desert d07459de,Desert,-89.830275,-34.692177,32.1,Baby require executive board southern education rate check happen wife fact task hard.
Mountain b93f6a92,Mountain,2.473527,-4.506683,376.21,Five case purpose home represent trouble recognize.
Forest cd3795ee,Forest,-12.707706,-122.683758,411.98,Tell wish business movement similar animal from democratic model.
Mountain d382c2d9,Mountain,86.420571,158.070086,325.98,Decade realize billion hair shoulder some method up quality politics Congress happy stuff.
River 5b2195a1,River,-41.655475,99.736645,620.76,Property by employee forward size campaign the then energy state teacher on.
Mountain e3608c40,Mountain,48.315327,-38.727965,111.02,Result form address different evening summer argue respond.
Lake 85a073a2,Lake,-85.926149,33.976971,481.05,Executive a next think could religious relate personal sound successful dog.
Forest a41b9bed,Forest,-20.100638,79.985395,535.77,Miss animal particular great improve her shake fight soldier.
River b21bb5e0,River,47.993037,-65.893608,34.71,East me yeah tree begin condition.
River 8e67b606,River,74.764374,-98.104628,8.74,Available lawyer respond production begin speak quickly among sort message.
Forest 26916188,Forest,-33.667415,-119.285044,335.45,Ten read staff others human raise.
Forest 3f380f08,Forest,-68.323295,61.994563,63.67,Black sort different local catch theory.
Lake 805d9a63,Lake,32.250356,-92.812409,645.38,While list process wear general lay itself help answer stock travel and.
Forest c62bdde7,Forest,45.547362,16.528651,522.37,Great recognize century process building especially.
Desert 773c713d,Desert,10.917722,34.469528,387.68,I run color Mrs treat sit six less.
Desert 5ca52daf,Desert,69.430058,126.158418,260.15,Source understand degree professional morning book because risk have budget land goal significant.
Lake 9bc4cf4e,Lake,-73.093541,14.877405,518.63,Us partner ask really compare enter accept development give available guess.
Lake e882fe87,Lake,14.391235,-55.448368,488.88,Race choice girl deal brother fact.
Forest b007134b,Forest,-62.414886,34.428586,906.15,Goal hour raise soldier full window military community.
Lake 4055a784,Lake,-20.136615,-96.595498,516.95,Moment someone poor rest cost exactly mean against baby civil performance area save.
Desert ef71d48c,Desert,41.497844,-41.851421,168.69,Mouth mouth of writer benefit result write which political structure maintain address.
Mountain a7a11906,Mountain,-86.385332,-28.598206,630.82,On effect radio room local necessary around must everybody.
Forest 07c1dd05,Forest,-81.916965,38.946878,487.65,Strategy letter maintain in anything use follow police sing.
Lake 8daddb2e,Lake,66.127575,30.99145,188.4,Painting prove voice look eye hand agency different.
Desert fc34542b,Desert,-42.990707,162.831121,14.67,Our note red which scene special production true reality.
Mountain c8b323ef,Mountain,-15.417268,-12.75839,240.7,Prepare bad authority medical factor than exist economic discover from attack blood two.
Desert 77ccfd97,Desert,-23.530158,-60.59979,915.39,Say realize foreign center future own keep or fast authority anything paper.
Desert 10d744ea,Desert,44.419168,0.92598,928.63,Ten citizen evidence think page audience child focus.
Lake 5d905da5,Lake,-56.564353,96.379345,406.56,Anyone road employee almost go response anything than type industry vote.
Forest f8566bee,Forest,14.676338,169.11044,163.56,Side reality left choose drop process according grow human now available successful ability.
Desert 1ff515fb,Desert,3.636822,-7.044821,704.18,Force official role car describe green million role study pattern model.
River 21843320,River,-34.748162,92.378196,997.75,President lay they half thousand garden people option sing position.
River d384b943,River,-62.763808,16.051884,919.47,Product those west individual life action author character voice determine form like.
Forest 93b0c916,Forest,-73.050195,-29.593482,996.27,Beautiful when personal look support white remain successful policy.
Lake ffd63c44,Lake,-9.599742,103.653316,833.19,Specific low western not doctor food skin her ball fact wide themselves.
Lake c6037e34,Lake,22.153182,152.890617,156.27,Air him itself white voice PM result factor space compare.
Forest 53967751,Forest,12.605362,86.201574,121.16,Card box either tax suddenly kind understand various cut hot establish industry debate.
Mountain 737c0fad,Mountain,-67.405075,142.149064,262.97,Too within model network present stuff professional million.
River 2d226ab3,River,85.528528,-165.691397,926.26,Course more lawyer any economic continue determine beyond within affect.
Lake 4bbbddef,Lake,0.073651,-150.249261,246.68,Sometimes set population born cut against indeed old again suddenly.
River 92c44ee7,River,-21.400629,120.29862,350.98,Full human often sort up produce simply movie cold him play clear.
Mountain 09e4dab6,Mountain,-47.445135,51.79343,376.67,Professional staff you another poor perform strong agree else million camera suggest interview.
River 0a7d0ed2,River,39.831708,143.266728,313.39,Account enter state four factor product.
Lake 8ecf6380,Lake,85.819069,145.829885,307.45,Cell compare rule fish from party leave group institution each fall former hold.
River 21a5e8cd,River,88.493978,-17.651166,440.14,Picture eye family right challenge military college newspaper general.
Mountain a58656c2,Mountain,-89.560967,-62.530326,802.35,Visit game side key matter worker TV or kind source summer exist add.
Mountain bee92ecb,Mountain,-60.601064,-93.785328,225.24,In sing off during several wife skin not keep our health about.
River 8c8cd054,River,-53.413871,68.699341,427.58,Budget week amount me talk man determine firm.
Lake 710d2a98,Lake,-58.584833,115.655079,176.79,Perform forget report than network eat.
Forest 83dcad7d,Forest,64.776777,-167.32669,64.78,Realize player culture several will outside play smile benefit.
Desert f6362cf0,Desert,-2.434282,-13.902529,660.05,Agreement size theory lot blue brother.
Desert 3e8aadef,Desert,16.194995,-82.272741,122.22,Sign various debate measure church arrive form purpose weight ask well compare not.
Desert e86c991c,Desert,-19.697634,-23.541391,664.28,Old question safe important likely small trade single help factor necessary government.
Lake 448c5a5e,Lake,-7.644007,41.702837,303.69,Opportunity term suggest marriage knowledge feel third once read though form pay.
River 33dd21da,River,-14.807082,-48.759097,245.97,Early would energy magazine per dark interview dog by movement quality pattern mission.
Desert 018f6b1b,Desert,31.657589,161.066264,603.63,Couple sign suddenly significant total heavy to kitchen pick billion participant.
Lake 8612759c,Lake,-25.502636,-7.54513,843.94,None skill author general consumer leader quality should issue where whatever tough.
Desert 1735858c,Desert,61.83083,105.974711,826.24,Economic purpose mother source performance music him help big mission.
Lake 7ba0469b,Lake,62.108441,-163.708422,443.6,Lead TV when own agent analysis rate.
River 8b0ea333,River,-83.113506,158.689471,840.95,Every difficult color participant actually themselves include question.
River a73c015d,River,33.242311,94.03134,713.84,Man major black imagine moment adult point street suggest few.
River 3ff8e156,River,9.111538,157.654151,231.13,Long like off most air detail by general.
Desert d582a103,Desert,-77.743231,-92.520604,274.68,Gas husband member security candidate race dark beyond my.
Mountain 7bbcd15f,Mountain,-3.963679,-103.466232,328.52,Sound perhaps major sister almost late sell seat.
River 68355d52,River,82.221655,66.067833,673.1,She find lay stop color state crime.
Mountain 7ddf9c27,Mountain,-10.57783,-93.801526,523.01,See play during magazine friend difference owner ball floor per wear plant teacher.
Mountain ce2747d0,Mountain,-59.799036,16.388492,303.87,Especially likely fast teacher trip girl.
Forest 89f45f90,Forest,-75.770048,139.635922,595.52,Deal fact war teach prove environment low discussion often wish fund bad.
Forest f19b55d9,Forest,37.588006,-105.119301,924.28,Read ready thousand where consumer live force system section fill rise themselves return.
Mountain 252a3b9a,Mountain,82.358486,76.863556,473.18,Defense including my offer green spring be.
Desert 809338a6,Desert,61.753608,31.968482,842.12,Hot however vote job kid lose us especially.
Forest ad807db2,Forest,63.915106,-109.7247,335.92,Listen catch think include create camera place story bar green hear guy.
Mountain 31a55283,Mountain,-76.37171,-79.777432,904.99,Never season kind next his seek find here any.
Mountain 060e5b0c,Mountain,-77.573419,149.831699,329.5,National there water threat positive doctor air question.
Mountain 830ab739,Mountain,-6.198757,-96.790914,179.69,Certainly by face in about market kid themselves rich student hope lay paper.
Mountain b6436157,Mountain,32.444453,44.689015,112.25,Unit until themselves matter later network seat natural structure material whatever.
Mountain 3de25542,Mountain,11.759832,-124.984753,457.29,Door experience arm medical within goal.
