name,feature_type,latitude,longitude,size,description
Lake 0ed39525,Lake,88.07515,15.939577,202.95,Sign seven example place boy ground life.
Forest 9d705dc1,Forest,55.399859,118.592232,907.76,Media go natural believe whom nor news dark why realize need.
Forest 67c66e67,Forest,37.420153,-134.533561,257.58,Interest white feel note knowledge young assume student similar drive family.
River 6bebe4f6,River,39.421424,-27.742651,694.76,Beyond program ready both high management.
Forest 0cfa04c1,Forest,-64.837498,-37.295475,53.46,Open score now coach position first add activity those toward then low.
Desert 0bdaf5af,Desert,65.915381,137.027199,578.37,Policy foreign discuss thing street police protect price television quality medical discuss region.
Mountain b152f543,Mountain,-38.37946,115.486672,98.98,New choose race every break drive dinner third father fight us need.
Lake 65acc47a,Lake,-62.95649,-172.256115,971.38,Prepare crime whom structure deep already conference message miss economy all.
Forest 146e8841,Forest,-37.455576,90.364986,230.41,Here military someone call quickly letter.
Forest 695a129a,Forest,38.083436,-108.01406,368.88,Campaign money short rest include writer fine American.
Lake 778e9e40,Lake,51.18001,17.449395,551.44,Give color development list simple season morning drive its none.
Mountain dbd20344,Mountain,-2.142399,-55.399681,602.18,Long among pay American end pressure both return deep long list.
Forest 33f46355,Forest,50.987226,143.549324,654.04,Couple price hot politics anyone for really.
River 0f95c75e,River,-0.779906,155.541903,134.08,Contain whose choose positive parent course place step down mention thus building reach.
Mountain 4224e28b,Mountain,-68.277923,157.161,390.57,Modern goal against level shoulder single power cultural.
Forest 481d3314,Forest,33.651613,-47.521186,253.05,Serve many real election would attention debate our house traditional return you pass.
Lake 7ecba2e5,Lake,48.412031,-28.524343,910.59,Address do consumer sense worker white the newspaper.
Lake 085d023d,Lake,-32.10606,-26.237393,956.28,Manager most push network accept car would condition as guy thing future.
Forest 29ddaa73,Forest,-77.319635,-99.209137,196.29,Eat me little sure something lose lawyer fact agency get person particularly.
Desert adcce82b,Desert,9.808634,-38.962261,543.97,Finally maintain follow suggest first page.
Lake 1aa0477d,Lake,-36.695171,-69.369052,905.77,Option sell number seek kind smile trouble mission some career work exist onto staff.
Desert 28ded971,Desert,-49.498171,-37.293182,338.62,Responsibility change understand issue certain get night.
Lake 168f0464,Lake,3.213894,44.998369,852.92,Customer new pass lose politics mission treatment.
Mountain f6f3bbaa,Mountain,-27.497813,164.028314,983.87,Maybe all institution fast year possible although scene stay three.
Lake a736ed5d,Lake,-11.371022,-168.714524,356.26,Several have religious really natural show goal ground.
Lake f2731335,Lake,-5.991741,44.306745,184.7,Ten alone decide fine leader either newspaper nothing quite.
River 39fefefc,River,-17.19328,1.998039,267.65,Site make tend speak fire nothing skin entire.
Lake 780f8d51,Lake,-88.598424,-71.85523,177.09,Physical part light her address analysis nature catch.
Lake ac4156ec,Lake,-2.173256,-33.373419,230.31,Future probably different loss enjoy onto father commercial store drive perhaps likely.
Forest f6adfc42,Forest,-75.721856,-74.886865,320.54,Main product training possible right threat possible charge member human kind Mr care.
Forest 1479faf4,Forest,-0.187899,80.285605,386.33,Without better poor game draw write know worry large traditional claim development yard.
Mountain a7655993,Mountain,-34.574216,-45.524802,329.53,Case economic win industry study perhaps beyond trip sometimes adult.
Lake 3d9f4403,Lake,-46.385467,124.034926,141.8,None provide local moment street technology data before bank none stay early city maintain.
Forest 8b5379a4,Forest,19.297725,-140.844019,283.86,In him lay fine administration sort less since either.
Mountain eb748de7,Mountain,-83.857193,45.099347,499.31,Shake scene black law medical argue field.
Lake 6b852758,Lake,31.400175,-151.243462,251.3,Certain skin bad child care single kid character.
Desert 612c62ec,Desert,45.671239,95.885129,656.31,Together more owner above statement system rock behavior exist professor.
Mountain fc5a335f,Mountain,-25.491539,43.087893,848.0,Tree population pattern poor week ready line statement south environmental check.
Mountain ed59cc0c,Mountain,-3.273491,-178.048476,577.7,Nature cold act why former west cost ground.
River c059dc9b,River,12.158721,40.066013,310.97,Computer industry thank effect suggest major property Mrs century include.
Desert d989adc5,Desert,-77.677145,16.316661,423.19,Business home civil test knowledge wonder relationship almost read listen factor.
Forest 9dd97702,Forest,-26.740367,-47.121246,812.96,Exist themselves nature boy tax worry.
Forest 99dfcbaa,Forest,11.289602,124.578384,712.62,Long positive property ten born realize not what final.
Desert 3e5355e1,Desert,-20.528801,-31.807537,938.21,Person six discussion include bag push.
River c3ca33e1,River,-89.825479,-151.00025,411.27,Carry water yet decision person usually science state effect point.
Mountain 67c6eec4,Mountain,-11.784532,-124.28546,802.5,City door should base top only someone level relationship.
Mountain bb2d970d,Mountain,68.42287,-74.012151,16.22,Mission level soldier probably on model person because.
Mountain 7ef24be9,Mountain,-83.766995,59.025397,948.94,Method month her wish reality this increase exist project head leave Democrat ago.
Desert d7da1a7a,Desert,-3.430931,-10.502795,31.9,Position education clear Congress worry town specific animal every assume set interview state.
Desert 1a408446,Desert,-20.89266,56.892179,960.94,Southern time worry government bed serve wall such person begin political bag too see.
River da50f876,River,-70.025096,76.199699,995.92,Economy sometimes loss war impact away security.
Mountain b74f626c,Mountain,-13.260057,39.181457,212.77,Ability budget grow who maybe security.
Lake 87307984,Lake,-65.68493,-62.565027,402.24,So necessary clearly gun thing realize.
Mountain d69eef5b,Mountain,34.617193,-16.427362,328.34,Full successful interview establish information see.
Forest 298392fd,Forest,-65.365345,-168.995751,6.21,Model yes leg term trade fact student.
Lake bea14d74,Lake,42.986987,-5.190488,955.56,Thousand scientist address on energy almost evidence wall first out able.
Desert 2b1b75af,Desert,3.2137,-56.511564,597.17,There apply decade lawyer particularly buy would say debate machine.
River d303231c,River,-24.66279,40.174995,904.76,Choice trouble administration today name middle western actually cut six success point.
Mountain 303572f9,Mountain,62.32431,135.855219,78.36,Finish world billion sign power heavy occur wind treat.
River db496f93,River,-64.60652,85.976668,68.61,Realize physical nothing enter pressure only various art add all others discover.
Desert c6252d40,Desert,14.554446,-109.424752,209.85,Hair church alone civil recently budget.
Desert bc5d1057,Desert,-89.576727,-52.637801,175.45,Wind economic finally boy side prove middle perhaps tell evening painting add.
Desert fe45c525,Desert,-30.407475,65.827537,845.07,Hour concern Democrat space similar building culture tell every affect into.
Desert 2522ffa3,Desert,37.653702,-11.565845,170.07,Give yet of effect wear far serve citizen out people represent.
River f85c299a,River,62.054419,-24.191498,417.39,Understand air identify a part since PM own American fast.
Desert 500655a2,Desert,69.457107,108.548852,471.85,Eight citizen lose man wide bring ability after material director.
Desert 9d7897ca,Desert,-22.200017,0.940299,923.92,Us staff six open sound add behind serve bank.
Mountain 849ea9aa,Mountain,-55.847526,-178.00495,780.43,Painting market something morning community daughter.
Desert fa20d942,Desert,16.948678,76.195153,647.97,Set strategy pull little loss station management apply give since.
River 785c4807,River,85.368779,-14.203368,656.9,Teacher PM change more treatment require moment responsibility free.
Forest 10dd6f74,Forest,81.692769,-132.065253,979.41,Girl every carry different world success really oil speech stage.
Lake 714c5fd1,Lake,-86.514989,-40.324111,969.8,Remain political area wind imagine opportunity throughout special learn hospital order during.
River 963c0c1a,River,66.247048,-38.024087,712.35,Raise my either major fund politics treatment room outside which speech future.
Desert cfbea2a2,Desert,-24.055114,-75.247325,430.49,Policy wish say discover brother who story ten.
Lake c5eac063,Lake,52.571488,1.380512,975.83,Once into exactly must east well trouble.
Mountain 84559c7e,Mountain,-52.436323,-165.979631,917.02,Nice film drop attorney reason Mr identify trial before decide matter wish reduce.
Lake 80e80e1d,Lake,-75.220241,123.484536,403.22,Bill kitchen pass stock hotel author seven nation police modern begin husband.
Mountain 7d9383ec,Mountain,-64.853215,120.657454,111.75,Product build business study serve when TV discussion.
Forest f881b97e,Forest,-60.140139,-96.101613,491.92,Morning difficult power exactly minute executive best know we quickly no.
River dcebfed5,River,-19.656653,-113.262718,505.11,Fish born watch you face suggest far necessary agency.
Lake ac624350,Lake,-79.22106,-34.479528,816.3,Skin money artist police hear summer dark management whole nation.
Forest e4e5ec3a,Forest,-2.743597,-166.536743,605.15,According goal part painting concern hotel purpose policy.
Mountain cf84a2be,Mountain,-14.730079,-14.668682,347.21,Some child question field traditional for add.
Mountain 14034383,Mountain,38.363148,-151.60777,360.93,Event hit before charge issue executive turn any tonight never foreign late like.
Desert 6438ed66,Desert,-30.228934,-82.967977,41.17,Answer every cold may food wear art mention challenge again surface.
Desert 04f7709a,Desert,61.165677,-147.458762,718.32,Attack relate rich organization none investment type message.
River 954fa938,River,22.556119,62.84298,954.81,Or perhaps think garden seat human mother price treatment hope beat.
River 14f7e380,River,-66.958162,-144.390059,840.25,Raise customer trial do drug popular official nice bed past door improve fire.
River 01ae9737,River,70.362461,-38.220792,211.49,Wish animal power anything much interest article.
Desert a3716040,Desert,-40.719315,-143.745246,78.22,Or day wide hundred pay focus high.
Desert 729f2de4,Desert,41.210836,14.657626,555.07,History example suffer relationship some hear financial voice someone.
Mountain 990f3921,Mountain,65.752212,-138.575403,281.38,Ahead deep design various there agreement technology able place.
Forest 60020333,Forest,55.859526,-163.872359,323.01,Let personal improve for contain just.
Forest dc0e1525,Forest,12.960187,136.174789,945.57,Increase thing face travel listen be.
Mountain 3ade2d9d,Mountain,-58.847178,122.422862,240.75,Wish some dream test including north drug.
Mountain 71a0f6ac,Mountain,10.219786,87.619106,412.2,Property coach more clear financial near break.
Lake a32fb2b3,Lake,-86.858649,86.268371,851.51,Item old whole same both feel.
Forest 57fcf886,Forest,-62.078665,-21.320528,966.67,Truth life what detail action here.
Mountain 1340ac2a,Mountain,-85.273701,120.270795,763.47,Issue military security visit throw participant down.
Desert 0d9f022d,Desert,7.910922,-80.67586,590.27,Pull mouth own its ground us language article.
Desert 5c6c4bf2,Desert,-89.762335,129.470497,770.95,Development quality onto experience add yard that candidate turn him.
Mountain af8ffd73,Mountain,54.065058,-142.385624,594.98,Compare raise question drive little society race.
Forest 3678e569,Forest,-5.196117,5.276359,391.72,Term strategy service number option individual suffer ten price huge.
River 108f6e92,River,-78.886167,-158.865592,180.77,Whose interest take reach business break well draw account already.
Desert e01f6b64,Desert,60.80442,102.197042,734.31,Along a phone after least establish seat pretty suffer travel.
Desert fa07f1f3,Desert,-11.228324,-98.031558,717.75,Away determine nation everybody population list similar.
Lake bff36958,Lake,2.234723,-4.783959,880.72,News size place across us door hair chance company travel charge.
Mountain ea944700,Mountain,-32.043503,48.671141,2.2,Music administration interest go news society somebody able especially until talk charge.
Mountain 87e190db,Mountain,70.266783,-69.318223,518.98,Person care nature worker from Congress against.
Mountain 8152580d,Mountain,7.330016,-166.31647,470.49,Wall he seem yet question despite product.
Desert e2c71712,Desert,-69.129779,98.087898,88.72,Almost federal small each inside begin marriage through miss.
Lake 73c570b4,Lake,-15.287961,105.454257,276.51,Main job simply week clear clear window least actually lose system.
Forest 16fdef66,Forest,23.863778,-158.288076,804.04,Kitchen chance authority management approach difficult learn able.
Lake c3fa9009,Lake,5.625213,135.590666,487.28,Charge five first capital be ago character within.
Desert 7295ab6d,Desert,37.309795,6.043371,345.77,Run indicate organization science police wrong sometimes get if deep example trouble design four.
Lake 030853f8,Lake,9.330193,-94.143789,783.56,Recently health risk college meet beat pattern conference his difference although.
Forest ceb15ca0,Forest,35.51579,-7.487618,324.69,Yourself represent church room assume he toward traditional past instead news pretty.
Desert 984d394a,Desert,-62.60391,-137.650705,60.6,Production financial argue room address stock will.
River ef68ee6a,River,73.776768,-63.984135,752.83,Manage including value fund different name TV fear large write make government.
Forest 4cb5a7bc,Forest,-83.191975,22.277471,637.92,Themselves oil far science help still while fly eye culture.
Mountain f1e739ea,Mountain,23.314065,10.150419,444.08,Hundred body huge world one affect.
Mountain 72d5990b,Mountain,-36.189313,-99.488221,701.97,Evidence institution really voice eye worker partner because red.
Lake 1814ec45,Lake,-5.593583,-12.986334,835.35,Size senior health cup partner join other.
Forest 89f080e3,Forest,-48.346124,72.198731,626.06,Clearly charge where wife image mission center.
Forest 447f8497,Forest,57.744303,-49.988911,14.64,Me spring until season require floor.
Mountain 660065b5,Mountain,6.304009,109.156966,239.05,Single current current direction beautiful federal future anyone fall consider eat.
Desert bf9a46be,Desert,51.251244,175.094907,407.33,Summer well hear represent officer war.
River 46ffe6a5,River,-77.270085,-68.993519,477.75,Audience him cut current although away white catch song throw oil organization.
Lake 250ecf61,Lake,-32.473246,92.323663,850.04,Require gun debate individual tonight hour detail move door expect.
Desert dfe97f52,Desert,3.505702,-38.870606,49.66,Fly treatment happy degree cold party return cover special.
Lake aaa0f843,Lake,-76.602952,-138.663359,650.56,Reality likely push drug force explain stock yourself free loss.
Mountain c4135122,Mountain,56.611671,-117.373842,834.13,Mouth follow receive try apply short few key especially animal hair chair.
Mountain 3420fe30,Mountain,-19.615668,158.95871,34.92,Ten professor little safe war president hundred drug.
Mountain 86ec8da6,Mountain,-45.185648,13.425053,773.8,Provide four kid since exactly magazine information continue bed yes play such her.
Desert e6d3824d,Desert,6.998741,142.598854,778.57,Collection medical drive friend case meeting over collection bill guy.
River 23648748,River,-41.055013,-1.504812,684.41,Worry enter read behind miss dinner.
Forest 11ac7243,Forest,10.271768,179.081763,68.27,As look behavior thousand total call street prove.
Desert 23fc94af,Desert,42.150559,-55.211552,728.08,Newspaper candidate sound financial long far call economic power recognize able watch key nature.
Lake d9370d02,Lake,72.109129,60.92743,738.23,Power none get gun senior order society forward involve road difficult reduce.
Desert 40dd000d,Desert,37.986446,-123.681395,947.95,School activity institution everybody rest spring least cup laugh.
Mountain b443d74f,Mountain,-3.843745,56.696935,115.61,Always away generation turn sit into physical myself character thing why deep nice.
Mountain b0520da2,Mountain,-49.186335,39.873973,794.3,Office so large talk center single may state north score nature.
Forest a056c760,Forest,-28.282993,63.718067,405.65,Enjoy student a result magazine class fall.
Mountain ce7d1d22,Mountain,-78.168698,-176.910433,909.34,Society positive eight keep politics return clear enter ability list far beyond perform.
Lake 5ef2285f,Lake,-0.352765,96.593091,45.16,Different drop six end situation lose throughout case end public serve behind lawyer.
Forest d6c60b1e,Forest,53.854369,-128.676853,795.24,Current investment now face she push significant shoulder under remember.
Lake 10336176,Lake,7.24069,-19.249384,889.88,Against western exactly dream Democrat when western step early we data purpose.
River 9a605382,River,-52.081619,-12.02165,125.39,Dark film concern end include ability ago open which page measure skin investment.
River 5b2d203d,River,76.660114,43.539075,932.87,Baby feel real whatever need not try seven nature best.
Mountain 394b2b5c,Mountain,10.313091,163.743115,779.51,Maintain also relate reveal support move before over tough quality.
Mountain db7251af,Mountain,1.08923,21.874471,426.76,Wall management treatment general able follow question why use economic indicate less final.
River d0a896aa,River,-60.20034,72.694084,452.19,Than never modern step way discussion cut image issue ground never.
Mountain e774509c,Mountain,77.427585,-161.916868,743.31,Land success performance yourself certainly challenge imagine language term teacher tell manager central.
Forest 97abcfb9,Forest,-29.093348,51.870697,214.47,Hand relate get throughout maybe response.
Lake 0f1c0d4d,Lake,53.561462,-38.60302,590.75,Total might enjoy begin charge quickly because after.
Desert d5789f50,Desert,14.032889,123.376075,213.01,Quality front crime direction final two according car democratic and data head.
Desert f50d1f23,Desert,44.393931,-31.015361,949.5,Job bank shake safe medical toward story indeed.
Desert 7490a225,Desert,-36.967882,59.997347,960.73,Day society doctor game audience wear prepare usually security follow.
Forest 9f049095,Forest,34.757361,137.340183,830.96,Marriage example out make usually Republican style full design.
River dba52901,River,83.498071,-177.027275,239.83,Especially up simply become democratic town radio painting.
Forest f91deb3e,Forest,5.168717,173.964543,737.05,Amount human finally spend west director region exist wish.
Desert 6a6fc331,Desert,87.849097,-114.679334,123.64,Star baby teacher take third truth mouth.
River 236d56c8,River,-51.723673,-148.296855,683.22,Tonight administration truth thus especially protect today fire activity stuff mouth.
Mountain b2159ce8,Mountain,-75.683312,-39.980967,173.51,Arrive teach school five answer here energy away.
Forest 03790e34,Forest,-41.661356,97.954354,596.93,Forward girl what performance space similar but oil throughout mouth read.
River 526b8ad6,River,37.983888,169.260276,4.91,Bag lose send season life heart large around.
River 334fa6af,River,43.22379,-142.650008,219.15,Firm include worry company mouth unit series film father.
Desert 94b321cf,Desert,75.83214,53.9238,441.76,Small road world serious development board indicate.
Desert 9644acbd,Desert,-56.817698,66.046225,383.88,Line meet threat our follow fly.
River 06fd24d9,River,-67.785997,-88.279173,778.82,Center future walk heart might shoulder agreement their air someone.
Mountain a877ffbc,Mountain,62.028908,-34.296446,448.38,Mind southern per interest mind from.
River c84c24dd,River,-16.145316,93.149977,999.65,Possible fill white speech every employee during our finally table door according.
Lake 8c0d463e,Lake,31.327141,-61.901753,707.59,Really staff money window ready speech identify east yard shake fire thus size.
Forest e9bcc315,Forest,24.10257,-131.686467,762.57,Hope fight when mouth international treat.
Mountain e16e9a13,Mountain,-73.59874,159.379615,945.33,Election whole letter stock trade various no must create great decision time left.
Mountain 0e51a11c,Mountain,-43.844034,53.997761,37.74,Mother face beat area network threat similar light same population force clear.
Forest d5fad218,Forest,-18.22678,-156.781794,352.55,Tend huge start clearly score later decision organization person wrong anything by.
Forest db472dc4,Forest,70.547928,56.787425,884.69,Than across during career up artist night.
Forest 6457d731,Forest,-78.054935,-37.44821,915.21,Specific according enough he lead fight mention others term number minute clear down.
Mountain ba047e75,Mountain,43.638321,-165.843198,223.86,Nation very fish itself none push how effort.
Forest fbeb8e5a,Forest,-67.330159,59.011607,356.41,Evening occur remain hotel attorney ground participant art true choose ago.
River 02fa0180,River,4.416044,-134.232299,186.64,Public which ok the majority product parent entire.
Mountain e2640a9b,Mountain,-19.788644,-7.569419,275.99,Conference require out because individual painting ground watch.
Forest bc386415,Forest,-77.643946,-65.161042,3.29,After about protect while million although story measure.
Desert 778e98b9,Desert,82.083303,53.92071,929.54,Respond picture many provide true still sing.
Desert cfa669aa,Desert,56.085948,28.859085,314.69,Set but dinner threat realize large majority there probably majority red young work.
Desert 9777f451,Desert,68.250302,-124.846715,768.72,Month establish network affect black believe its pull.
Forest 33d78da1,Forest,-18.048272,97.241777,932.86,Over student station country appear line lose contain industry report.
Lake 64a06bc6,Lake,57.912826,0.35011,456.87,Guy tree your each ask save inside good walk.
River 487a88cf,River,27.851115,-43.898195,446.27,Leave reduce again take reality hear south.
River da8f0970,River,-50.620644,25.787454,446.85,Though tell sell it media activity air blue trade clear sometimes us contain.
Forest d23731af,Forest,-57.553936,39.133966,860.46,Fall car cell child find rise notice source old use cultural.
Mountain b488982c,Mountain,59.669419,-135.10823,310.4,Foot catch across compare successful sport among most dark white.
Mountain a543663d,Mountain,-35.694174,-113.424286,256.64,Instead industry little exactly without tough seem administration speak from.
Forest 48fcc2d2,Forest,52.140877,176.078669,42.98,Investment official prepare budget letter herself may reason.
Desert 7a678c67,Desert,-37.598752,100.802316,54.51,He understand apply hand lose some describe.
Desert ab9b1b91,Desert,-79.46431,-117.680083,672.07,People coach understand case something live hope.
Mountain e6d4e734,Mountain,62.889577,-145.492706,518.21,However here however sea between wife stop discuss.
Mountain 27d63815,Mountain,-48.327183,135.144388,729.98,On another order this especially ahead month author.
Forest d8fdffb0,Forest,-3.530384,117.605605,655.45,Industry majority want assume child adult kid difficult mouth land all act.
Desert c802de5f,Desert,19.648637,124.917256,932.57,Provide coach indeed must front give say.
River 01d548e8,River,4.652092,-107.667316,818.57,Hotel information local agree data thank brother series red behavior door.
Lake 0e8d31d7,Lake,31.094638,67.372977,67.24,Against finish carry family often determine radio student your mean either.
Mountain b31b6fb0,Mountain,-5.640603,175.859176,90.44,Whom chance continue last party heavy professional he bank coach.
Forest bf3f33c3,Forest,-23.349373,152.837688,215.45,President walk contain paper institution growth personal.
Mountain 672b5e60,Mountain,-25.966711,-37.014011,987.69,Dark final new nature provide security community happen specific data realize total matter.
Lake 4ae9e521,Lake,-6.292149,-110.402828,928.58,Benefit yeah customer sell build week although ago quality.
Forest d0bf9048,Forest,-13.230295,40.146718,145.88,Customer plan like reveal every much.
River 26f9c1cf,River,-1.901496,11.217324,856.46,Conference give religious take ahead man ahead structure through create hear price develop.
Mountain d086ccf5,Mountain,77.171679,167.358205,547.09,Carry court color child look value else cause PM sell day get else.
Lake 8fd4ac82,Lake,-34.731455,-89.940535,102.25,Bed hand local lose particular center detail then until value near factor board media.
Mountain c0c00f70,Mountain,-33.178569,17.250964,12.25,Lawyer how free administration claim parent attack.
River 88ba0609,River,87.621246,137.456396,968.3,Machine important ago she sound high.
Mountain a74766bf,Mountain,-81.418007,99.588701,483.96,Before former deal too long structure leader.
Forest fa401c88,Forest,7.112289,-140.169179,95.15,Store that building country animal bill main apply low challenge sometimes area accept.
River d804dc9f,River,9.392515,107.864453,402.81,Use party lot still democratic way mother.
Mountain 325ad245,Mountain,6.308648,59.93127,138.8,Tell level else they down physical three red.
River 75c024a7,River,56.615619,-27.255704,15.9,Per machine everybody child attorney attention.
Lake b4e6b4b2,Lake,82.373073,-58.353522,105.81,None attorney like doctor call six dog.
Lake 5e834e1d,Lake,48.138319,-35.727442,417.2,Herself plant prevent experience central so suggest home.
Forest 511f4603,Forest,-78.351965,36.70167,540.95,Treat unit sound yet leave itself fall walk.
River d70fb95b,River,-32.368626,134.857088,158.13,Him us hair him site paper few hold development as clear.
Desert cbd15a9b,Desert,83.965918,85.621409,486.92,Body under discuss on likely huge actually dream business base.
Mountain 5a33c399,Mountain,-15.946367,-113.345073,548.2,Military lay TV back building likely every toward.
Lake bc481e2e,Lake,-34.047074,-76.392439,66.15,This exist onto forget mention degree citizen majority young environment push born.
Desert f4b53bcc,Desert,-51.928771,81.297085,362.18,Sign study agreement room statement business.
Mountain 452eab58,Mountain,45.942766,83.485407,718.16,Outside maybe begin the instead design agreement somebody.
